{"artifact_epoch":1,"build_receipt_id":"abbd693d6b993271b352381c7c6f30c67c3a2a6ddc417c36b5e7b85f28224d0e","campaign_id":"20261014T152945Z-38708-5b51627373364b24bf87799e4827dd51","campaign_sequence":1,"canonicalization":"rs-canonical-json-v1","coverage_plan_digest":"0745f19049032efee0a1bc62ed31b753280b21ad31cea2a7a0351cd96b1141d8","decision_digest":"7558a720e9be082a9ca08e1472861d07cd1793e49073aefa6454cd67d6b1329a","entries":[{"decision":"execute","expected_fingerprint":"7bde499c071a00e92082aa4dc224878bb4f9c5309a3e6f6786a249be3ce3dd1b","id":"tooling.pester-build-toolchain","ordinal":0,"origin_evidence_digest":null,"origin_run_id":null,"promotion_digest":null,"reason_codes":["SOURCE_INPUT_CHANGED"],"status":"running"},{"decision":"execute","expected_fingerprint":"ab0cbcf6eb9ddb444082d1c6b00013f8e2089186ec5067531835ca9d5782cb4d","id":"selftest.compare-directories","ordinal":1,"origin_evidence_digest":null,"origin_run_id":null,"promotion_digest":null,"reason_codes":["SOURCE_INPUT_CHANGED"],"status":"pending"},{"decision":"execute","expected_fingerprint":"34c43cffda16c6fe36d56d33a8cd65169517c3128920eee097d82aafd17d46fc","id":"standalone.product-ui","ordinal":2,"origin_evidence_digest":null,"origin_run_id":null,"promotion_digest":null,"reason_codes":["SOURCE_INPUT_CHANGED"],"status":"pending"},{"decision":"execute","expected_fingerprint":"e7f43fbe39adba3f54200f738385899eaceee424450492139528ab25619c0273","id":"viewer-pe.noninteractive","ordinal":3,"origin_evidence_digest":null,"origin_run_id":null,"promotion_digest":null,"reason_codes":["SOURCE_INPUT_CHANGED"],"status":"pending"},{"decision":"execute","expected_fingerprint":"6e1d7d139c40ee95671d585783b1303b110c07a96acaec40664118ea60e627da","id":"viewer-sqlite.noninteractive","ordinal":4,"origin_evidence_digest":null,"origin_run_id":null,"promotion_digest":null,"reason_codes":["SOURCE_INPUT_CHANGED"],"status":"pending"},{"decision":"execute","expected_fingerprint":"15bffd1fa2225791ef2f95647dbbf45427c39a2af9ae02c30344f31ca9cb2aaf","id":"standalone.filesystem-curl","ordinal":5,"origin_evidence_digest":null,"origin_run_id":null,"promotion_digest":null,"reason_codes":["SOURCE_INPUT_CHANGED"],"status":"pending"},{"decision":"execute","expected_fingerprint":"f577577685cff52f96481f8ebd8cb866011a43537e30af371d32e26e3169151e","id":"standalone.monitor","ordinal":6,"origin_evidence_digest":null,"origin_run_id":null,"promotion_digest":null,"reason_codes":["SOURCE_INPUT_CHANGED"],"status":"pending"},{"decision":"execute","expected_fingerprint":"fbee6e2510d7c10b8b69fd251766231a3dea7c1e2202499d89bd852e6d6983d0","id":"standalone.localization","ordinal":7,"origin_evidence_digest":null,"origin_run_id":null,"promotion_digest":null,"reason_codes":["SOURCE_INPUT_CHANGED"],"status":"pending"},{"decision":"execute","expected_fingerprint":"06f3da3e08f0b1e632869879e3b19e80e0d062803e1586bb3019e69b73c8fac4","id":"standalone.red-configure","ordinal":8,"origin_evidence_digest":null,"origin_run_id":null,"promotion_digest":null,"reason_codes":["SOURCE_INPUT_CHANGED"],"status":"pending"},{"decision":"execute","expected_fingerprint":"a97b68298e90056ae5a1081ded827bdb2522c9177681e4bdf66a5ff94918d48b","id":"standalone.plugin-contract","ordinal":9,"origin_evidence_digest":null,"origin_run_id":null,"promotion_digest":null,"reason_codes":["SOURCE_INPUT_CHANGED"],"status":"pending"},{"decision":"execute","expected_fingerprint":"9bdc5319625098891cc4a9af46ac78c966b7931c45e2e2fb242303910f38f0d8","id":"standalone.settings-schema","ordinal":10,"origin_evidence_digest":null,"origin_run_id":null,"promotion_digest":null,"reason_codes":["SOURCE_INPUT_CHANGED"],"status":"pending"},{"decision":"execute","expected_fingerprint":"87f8e1ddf46582a221077fa697ed0df1f1f8ff51ee686524a32a5d0e44caaa6f","id":"standalone.crash-handling","ordinal":11,"origin_evidence_digest":null,"origin_run_id":null,"promotion_digest":null,"reason_codes":["SOURCE_INPUT_CHANGED"],"status":"pending"},{"decision":"execute","expected_fingerprint":"3f167a4b73d3439ce2df5c3f0d1048b4e8754584b552ee70afc1b5c82046f2d7","id":"perf.performance-tests2","ordinal":12,"origin_evidence_digest":null,"origin_run_id":null,"promotion_digest":null,"reason_codes":["SOURCE_INPUT_CHANGED"],"status":"pending"},{"decision":"execute","expected_fingerprint":"4da692262837e26f6f426f0c4176f5d07d3b391e6e7a1dba557b8951b9527a64","id":"tooling.pester","ordinal":13,"origin_evidence_digest":null,"origin_run_id":null,"promotion_digest":null,"reason_codes":["SOURCE_INPUT_CHANGED"],"status":"pending"},{"decision":"execute","expected_fingerprint":"66703b64d017ff23cfc59b399ff563a7bf295a6c64336b58a8d797e20ebc0a1e","id":"tooling.vcpkg-merge-synthetic","ordinal":14,"origin_evidence_digest":null,"origin_run_id":null,"promotion_digest":null,"reason_codes":["SOURCE_INPUT_CHANGED"],"status":"pending"}],"mutation_state":"mutating","parent_run_id":null,"plan_digest":"35e0bfcf18799fb87f5673b83eccf5cb2526ce955d1dbc4270631f38ec899e6d","requested_suite":"Full","run_id":"20261014T152945Z-38708-5b51627373364b24bf87799e4827dd51","schema":"red-salamander.validation-run-state.v1","snapshot_id":"180bb20cdea4370b1c3376df556a6c1000e51c6a6e58386afeb63c4854d3a152","status":"running","validation_mode":"Fresh"}
